{
  "ruleId": "eol-last",
  "pattern": "([^\\n])$",
  "fix": "$1\n",
  "severity": "info",
  "category": "Style",
  "flags": "",
  "confidence": "pilot",
  "aliases": [
    "style/eol-last"
  ],
  "description": "Enforce at least one newline character at the end of non-empty files for POSIX compatibility.",
  "tags": [
    "style",
    "formatting",
    "posix"
  ]
}
