{
  "ruleId": "linebreak-style",
  "pattern": "\\r\\n",
  "fix": "\n",
  "severity": "info",
  "category": "Style",
  "flags": "g",
  "confidence": "pilot",
  "aliases": [
    "style/linebreak-style"
  ],
  "description": "Enforce consistent Unix linebreaks (\n) and strip carriage return characters (\r\n).",
  "tags": [
    "style",
    "formatting",
    "linebreaks"
  ]
}
