{
  "ruleId": "prefer-const",
  "category": "Quality",
  "severity": "low",
  "confidence": "pilot",
  "pattern": "",
  "fix": "",
  "handler": "prefer-const-line",
  "aliases": [
    "@typescript-eslint/prefer-const",
    "quality/prefer-const"
  ],
  "description": "Suggest const declarations for variables that are never reassigned after initial declaration.",
  "tags": [
    "quality",
    "immutability",
    "es6"
  ]
}
