{
  "ruleId": "security/eval",
  "category": "Security",
  "severity": "critical",
  "flags": "g",
  "confidence": "pilot",
  "pattern": "\\beval\\s*\\(",
  "fix": "/* x185-rule:eval-removed */ void(",
  "aliases": [
    "eval",
    "no-eval",
    "security/no-eval"
  ],
  "description": "Disallow the use of eval() which executes arbitrary strings as code, opening code injection vulnerabilities.",
  "tags": [
    "security",
    "injection",
    "cwe-95"
  ]
}
