{
  "ruleId": "no-debugger",
  "category": "Quality",
  "severity": "medium",
  "flags": "g",
  "confidence": "pilot",
  "pattern": "\\bdebugger\\s*;?",
  "fix": "/* x185-rule:debugger-removed */",
  "aliases": [
    "quality/no-debugger",
    "debugger"
  ],
  "description": "Disallow debugger statements in production code to prevent unexpected browser execution pauses.",
  "tags": [
    "quality",
    "clean-code",
    "debugging"
  ]
}
