{
  "ruleId": "unused-import",
  "category": "Cleanup",
  "severity": "low",
  "confidence": "pilot",
  "pattern": "",
  "fix": "",
  "handler": "unused-import-line",
  "aliases": [
    "no-unused-vars",
    "no-unused-imports",
    "@typescript-eslint/no-unused-vars",
    "imports/unused",
    "unused_import",
    "quality/unused-import"
  ],
  "description": "Detect and remove unused imported symbols and lines to keep bundles lean and reduce dead code.",
  "tags": [
    "cleanup",
    "imports",
    "bundle-size"
  ]
}
