{
  "ruleId": "no-multiple-empty-lines",
  "pattern": "\\n{4,}",
  "fix": "\n\n\n",
  "severity": "info",
  "category": "Style",
  "flags": "g",
  "confidence": "pilot",
  "aliases": [
    "style/no-multiple-empty-lines"
  ],
  "description": "Disallow four or more consecutive blank lines to maintain clean, readable formatting.",
  "tags": [
    "style",
    "whitespace",
    "formatting"
  ]
}
