{
  "ruleId": "unicode-bom",
  "pattern": "^\\ufeff",
  "fix": "",
  "severity": "info",
  "category": "Style",
  "flags": "",
  "confidence": "pilot",
  "aliases": [
    "style/unicode-bom"
  ],
  "description": "Disallow Unicode byte order mark (BOM) at the beginning of UTF-8 files.",
  "tags": [
    "style",
    "encoding",
    "unicode"
  ]
}
