{
  "ruleId": "no-irregular-whitespace",
  "pattern": "[\\f\\v\\u00a0\\u1680\\u180e\\u2000-\\u200a\\u202f\\u205f\\u3000]",
  "fix": " ",
  "severity": "low",
  "category": "Security",
  "flags": "g",
  "confidence": "pilot",
  "aliases": [
    "security/no-irregular-whitespace"
  ],
  "description": "Disallow irregular whitespace characters (zero-width spaces, non-breaking spaces) that cause syntax issues.",
  "tags": [
    "style",
    "whitespace",
    "clean-code"
  ]
}
