{
  "ruleId": "security/new-function",
  "category": "Security",
  "severity": "critical",
  "flags": "g",
  "confidence": "pilot",
  "pattern": "\\bnew\\s+Function\\s*\\(",
  "fix": "/* x185-rule:new-function-removed */ void(",
  "aliases": [
    "no-new-func",
    "security/function-constructor"
  ],
  "description": "Disallow Function constructor (new Function) which compiles strings into executable code at runtime.",
  "tags": [
    "security",
    "injection",
    "eval"
  ]
}
